{
  "schema_version": 1,
  "run_id": "fixture-dprk-deep-typed",
  "query": "Cl0p MOVEit extortion group",
  "refined_queries": ["Cl0p MOVEit ransomware"],
  "depth": "deep",
  "started_at": "2026-10-11T19:21:16.260Z",
  "completed_at": "2026-10-11T19:28:16.321Z",
  "engine_version": "0a0ed800",
  "summary": {
    "markdown": "### Intelligence Summary: Cl0p MOVEit Ransomware **Threat Activity Found:** The query \"Cl0p MOVEit ransomware\" yielded insights into ransomware-related activity on dark web forums. Notably, the RansomLook platform (http://s7nkzfidtdsifuypedipxufuo5jh6tjb6qz2hjxrp553s55auxwrsl5d.onion/p/f57f30) provides a comprehensive overview of ransomware groups, including Cl0p. The platform tracks 43 active ransomware groups, with 2 new groups emerging in the past week. Cl0p is not explicitly mentioned in the provided data, but the context suggests it operates within this ecosystem, given its prominence in recent ransomware campaigns. The platform also highlights 9,369 leaks, 936 ransom notes, and 11,192 cryptocurrency addresses, indicating a robust ransomware economy. **Key Actors, Tools, or Infrastructure Identified:** The Injection Team Group (http://w5oirss3p6gdkr5wh2lx66i365d4jlxnik3x66uvyb7cintjut3pk3bd.onion/p/143cca) positions itself as a hub for ethical hacking and cybersecurity resources. While not directly linked to Cl0p, such forums often serve as breeding grounds for ransomware tools and techniques. The RansomLook platform identifies 631 groups, 147 markets, and 32 actors, suggesting a highly organized ransomware landscape. The presence of 1,801 cross-group IPs and 1,424 swarms tracked indicates shared infrastructure and collaboration among ransomware operators. **Operational Significance for Security Teams:** Security teams should monitor platforms like RansomLook for emerging ransomware groups and trends, as they provide actionable intelligence on active campaigns and infrastructure. The Injection Team Group, while claiming ethical intentions, could be a source of leaked tools or techniques that threat actors might exploit. Tracking cryptocurrency addresses and cross-group IPs can help identify shared infrastructure and disrupt ransomware operations. Additionally, the high volume of leaks and ransom notes underscores the need for robust incident response and data protection strategies to mitigate ransomware impacts.",
    "key_findings": [
      "Intelligence Summary: Cl0p MOVEit Ransomware Threat Activity Found: The query \"Cl0p MOVEit ransomware\" yielded insights into ransomware-related activity on dark web forums.",
      "Notably, the RansomLook platform (http://s7nkzfidtdsifuypedipxufuo5jh6tjb6qz2hjxrp553s55auxwrsl5d.onion/p/f57f30) provides a comprehensive overview of ransomware groups, including Cl0p.",
      "The platform tracks 43 active ransomware groups, with 2 new groups emerging in the past week.",
      "Cl0p is not explicitly mentioned in the provided data, but the context suggests it operates within this ecosystem, given its prominence in recent ransomware campaigns."
    ],
    "risk_notes": [
      "32 typed relationships are model-extracted co-mentions and are not verified attribution.",
      "0 entities are flagged sensitive and shown masked."
    ],
    "confidence": "medium",
    "source_count": 9
  },
  "entities": [
    {
      "id": "599940cf-c3aa-4322-938c-7deb04f5307d",
      "type": "RANSOMWARE_GROUP",
      "value": "CL0P",
      "display_value": "CL0P",
      "sensitive": false,
      "confidence": 0.5603807999999999,
      "first_seen": "2026-10-11T19:26:25.427Z",
      "source_ids": ["s9"],
      "tags": ["method:ner"]
    },
    {
      "id": "dc36fa4b-4f54-464e-b436-74eaea4e5a20",
      "type": "RANSOMWARE_GROUP",
      "value": "lockbit",
      "display_value": "lockbit",
      "sensitive": false,
      "confidence": 0.9083424,
      "first_seen": "2026-10-11T19:26:24.988Z",
      "source_ids": ["s6"],
      "tags": ["method:ner"]
    },
    {
      "id": "0b877dca-fc40-4e34-9618-585447bea109",
      "type": "MALWARE_FAMILY",
      "value": "StealBit",
      "display_value": "StealBit",
      "sensitive": false,
      "confidence": 0.8795108,
      "first_seen": "2026-10-11T19:26:25.027Z",
      "source_ids": ["s6"],
      "tags": ["method:llm"]
    },
    {
      "id": "0cfb7cea-b395-4139-9e33-2b753154018a",
      "type": "MALWARE_FAMILY",
      "value": "Cobalt Strike",
      "display_value": "Cobalt Strike",
      "sensitive": false,
      "confidence": 0.8795108,
      "first_seen": "2026-10-11T19:26:25.018Z",
      "source_ids": ["s6"],
      "tags": ["method:llm"]
    },
    {
      "id": "10ddc818-af2f-4c47-910b-c8f04532f2ac",
      "type": "MALWARE_FAMILY",
      "value": "LockBit 2.0",
      "display_value": "LockBit 2.0",
      "sensitive": false,
      "confidence": 0.8795108,
      "first_seen": "2026-10-11T19:26:25.015Z",
      "source_ids": ["s6"],
      "tags": ["method:llm"]
    },
    {
      "id": "520fad3b-b93a-46ea-bd78-e11e47464f88",
      "type": "MALWARE_FAMILY",
      "value": "LockBit 3.0",
      "display_value": "LockBit 3.0",
      "sensitive": false,
      "confidence": 0.8795108,
      "first_seen": "2026-10-11T19:26:25.030Z",
      "source_ids": ["s6"],
      "tags": ["method:llm"]
    },
    {
      "id": "027e6b36-0f9d-4629-8ab3-0696a14402f2",
      "type": "ONION_URL",
      "value": "http://r3qpybm34jaqorzbdn5rnreduhd7vgnua7t57lwuds233hgib4govcxd.onion",
      "display_value": "http://r3qpybm34jaqorzbdn5rnreduhd7vgnua7t57lwuds233hgib4govcxd.onion",
      "sensitive": false,
      "confidence": 0.9506,
      "first_seen": "2026-10-11T19:26:24.985Z",
      "source_ids": ["s6"],
      "tags": ["method:regex"]
    },
    {
      "id": "a3404f4e-b5b3-418a-9d40-b43db784b397",
      "type": "CVE_NUMBER",
      "value": "CVE-2023-34362",
      "display_value": "CVE-2023-34362",
      "sensitive": false,
      "confidence": 0.5865199999999999,
      "first_seen": "2026-10-11T19:26:25.403Z",
      "source_ids": ["s9"],
      "tags": ["method:regex"]
    },
    {
      "id": "03556d11-18ad-4366-a7fb-bdd82e3aeaf8",
      "type": "THREAT_ACTOR_HANDLE",
      "value": "silent_raven77",
      "display_value": "silent_raven77",
      "sensitive": false,
      "confidence": 0.8795108,
      "first_seen": "2026-10-11T19:26:24.981Z",
      "source_ids": ["s2"],
      "tags": ["method:llm"]
    },
    {
      "id": "2b718087-cceb-4da5-852f-c59a425074e8",
      "type": "MALWARE_FAMILY",
      "value": "Babadeda Crypter",
      "display_value": "Babadeda Crypter",
      "sensitive": false,
      "confidence": 0.8795108,
      "first_seen": "2026-10-11T19:26:25.021Z",
      "source_ids": ["s6"],
      "tags": ["method:llm"]
    },
    {
      "id": "37cadd47-df03-4269-bff3-c59c71182819",
      "type": "MALWARE_FAMILY",
      "value": "Ragnar Locker",
      "display_value": "Ragnar Locker",
      "sensitive": false,
      "confidence": 0.8795108,
      "first_seen": "2026-10-11T19:26:25.032Z",
      "source_ids": ["s6"],
      "tags": ["method:llm"]
    },
    {
      "id": "3c8475b4-dc18-430e-902c-504e9c24a181",
      "type": "MALWARE_FAMILY",
      "value": "SocGholish",
      "display_value": "SocGholish",
      "sensitive": false,
      "confidence": 0.8795108,
      "first_seen": "2026-10-11T19:26:25.024Z",
      "source_ids": ["s6"],
      "tags": ["method:llm"]
    },
    {
      "id": "ae5d8b12-8c7d-45a1-84eb-d92696f50d39",
      "type": "MALWARE_FAMILY",
      "value": "BLISTER",
      "display_value": "BLISTER",
      "sensitive": false,
      "confidence": 0.8795108,
      "first_seen": "2026-10-11T19:26:25.035Z",
      "source_ids": ["s6"],
      "tags": ["method:llm"]
    },
    {
      "id": "eca8d685-a5a6-4dfc-95cb-7f01516c6963",
      "type": "MALWARE_FAMILY",
      "value": "PrivateLoader",
      "display_value": "PrivateLoader",
      "sensitive": false,
      "confidence": 0.8795108,
      "first_seen": "2026-10-11T19:26:24.997Z",
      "source_ids": ["s6"],
      "tags": ["method:llm"]
    },
    {
      "id": "42a76d27-a2a3-4e5f-862b-552f4b2ee53b",
      "type": "ONION_URL",
      "value": "http://xn46mxo5rlk53aa52s3ghbvvobcslv5d2j6lsb7yavjqdkn27lsxtspd.onion",
      "display_value": "http://xn46mxo5rlk53aa52s3ghbvvobcslv5d2j6lsb7yavjqdkn27lsxtspd.onion",
      "sensitive": false,
      "confidence": 0.9506,
      "first_seen": "2026-10-11T19:26:25.391Z",
      "source_ids": ["s7"],
      "tags": ["method:regex"]
    },
    {
      "id": "3e4e5258-e01b-44ee-bbff-d8724e5eef39",
      "type": "THREAT_ACTOR_HANDLE",
      "value": "vivid_raven25",
      "display_value": "vivid_raven25",
      "sensitive": false,
      "confidence": 0.8434468,
      "first_seen": "2026-10-11T19:26:25.395Z",
      "source_ids": ["s8"],
      "tags": ["method:llm"]
    },
    {
      "id": "2751c350-0372-424d-93b3-fb7d06a86607",
      "type": "RANSOMWARE_GROUP",
      "value": "alphv",
      "display_value": "alphv",
      "sensitive": false,
      "confidence": 0.9083424,
      "first_seen": "2026-10-11T19:26:25.009Z",
      "source_ids": ["s6"],
      "tags": ["method:ner"]
    },
    {
      "id": "455397a2-0c99-4ecd-b591-677abd66034d",
      "type": "RANSOMWARE_GROUP",
      "value": "maze",
      "display_value": "maze",
      "sensitive": false,
      "confidence": 0.9083424,
      "first_seen": "2026-10-11T19:26:24.994Z",
      "source_ids": ["s6"],
      "tags": ["method:ner"]
    },
    {
      "id": "8a6daf05-7067-4371-8d80-2838a7727d82",
      "type": "RANSOMWARE_GROUP",
      "value": "darkside",
      "display_value": "darkside",
      "sensitive": false,
      "confidence": 0.9083424,
      "first_seen": "2026-10-11T19:26:25.006Z",
      "source_ids": ["s6"],
      "tags": ["method:ner"]
    },
    {
      "id": "ac319731-0c2b-4d11-a9ce-fc572b7b6c7d",
      "type": "RANSOMWARE_GROUP",
      "value": "blackmatter",
      "display_value": "blackmatter",
      "sensitive": false,
      "confidence": 0.9083424,